{
  "schema_version": 1,
  "rehearsal_id": "v0.1.12-retroactive-simulation-1",
  "release_plan_id": "bot-v0.1.12-retroactive-simulation",
  "release_plan_digest": "sha256:1bac5e85090e310a82c1c6dd0b36759302efde0e271a7e7e8bc015266040c166",
  "version": "0.1.12",
  "component_commits": {
    "bot": "a79b0cc525a149671f7affa4af5d958ad56a7fce",
    "cloud": "c7bc81731f782828df7a0794a1260ca7056ff5c2",
    "mcp": "29801c5e7d069e75be1336f53f160011e3e5fdd3",
    "integrations": "80ddb4cdc3ab9c7ca904a74b2e87b171ccba9826"
  },
  "evaluated_under": {
    "factory_commit": "98d3d9b54aea2de3167ab1ff2216bd0f2e18aed5",
    "closure_policy_digest": "sha256:ad821c4d31e0207143afadeaeff07ac389a7e66302ab252edbecc6567a88af2d"
  },
  "required_closures": [
    "desktop_hosted_key_pairing_v1",
    "installer_updater_v1"
  ],
  "artifact_destination": {
    "kind": "github_actions_artifact",
    "name": "v0.1.12-retroactive-simulation-1"
  },
  "publication": {
    "git_tag": false,
    "github_release": false,
    "production_r2_latest": false,
    "cloud_deploy": false
  },
  "created_by": "simulation:delivery-manager:jinhongkuan",
  "created_at": "2026-07-22T14:00:00Z"
}
